79, Au , Gold,Ancient,,"Gold has been known from prehistoric times and was possibly the first metal used by humans. It was valued for ornaments and magical efficacy was attributed to it. In the Middle Ages alchemists sought to transmute baser metals into gold. The quest for gold stimulated European explorations and conquests, and its discovery has led to many a gold rush."
80, Hg , Mercury,Ancient,,"Mercury was known to ancient Chinese and Hindus before 2000 BC and was found in tubes in Egyptian tombs dated from 1500 BC It was used to forma amalgams of other metals around 500 BC. The Greeks used mercury in ointments and the Romans used it, unfortunately for those using it, in cosmetics."
81, Tl , Thallium,1861,Sir William Crookes,"Thallium was discovered spectroscopically in 1861 by Crookes. The element was named after the green spectral line, which identified the element (Greek ""thallos"", green twig). They had been expecting to isolate tellurium after removing selenium from the byproducts from a commercial sulphuric acid factory but instead found the new element thallium."
82, Pb , Lead,Ancient,,"Lead has been known for ages and is mentioned in Exodus. Alchemists believed lead to be the oldest metal and associated it with the planet Saturn. They spent a lot of time trying to ""transmute"" lead into gold."
83, Bi , Bismuth,Ancient,,"In early times bismuth was confused with tin and lead. So although bismuth had been discussed many times before, Claude Geoffroy the Younger showed it to be distinct from lead in 1753."
84, Po , Polonium,1898,Marie Curie,"Polonium was the first element discovered by Marie Sklodowska Curie in 1898, while seeking the cause of radioactivity of pitchblende from Joachimsthal, Bohemia. It required several tonnes of pitchblende to produce very small amounts of polonium."
85, At , Astatine,1940,Dale Corson,"Astatine was synthesized in 1940 by Dale Corson and others at the University of California, USA, by bombarding bismuth (209Bi) with ?-particles."
86, Rn , Radon,1900,Friedrich Dorn,"Radon was discovered in 1900 by Friedrich Ernst Dorn, who called it niton. It is essentially inert. It has been called radon since 1923, before which it was called niton."
87, Fr , Francium,1939,Marguerite Perey ,"Francium was discovered in 1939 by Marguerite Perey of the Curie Institute in Paris, (France) but its existence was predicted by Mendeleev during the 1870's. Since its properties should track those of caesium rather closely, he called it eka-caesium."
88, Ra , Radium,1898,"Marie Curie, Pierre Curie","Radium was discovered in 1898 by Marie and Pierre Curie in pitchblende (or uraninite) from North Bohemia. The element was isolated in 1911 by Mme. Curie and Debierne by the electrolysis of a solution of pure radium chloride, employing a mercury cathode. On distillation in an atmosphere of hydrogen this amalgam yielded the pure metal."
89, Ac , Actinium,1899,Andre Debierne,"Actinium was discovered by Andre Debierne in 1899 and independently by F. Giesel in 1902, both of whom obtained it while working on separation techniques for rare earth oxides."
90, Th , Thorium,1828,Berzelius,Thorium was discovered by Berzelius in 1828 in a mineral given to him by the Reverend Has Morten Thrane Esmark.
91, Pa , Protactinium,1913,"Hahn, Meitner,Soddy,Cranston","Protactinium is found in pitchblende and ores form Zaire and is one of the rarest and most expensive naturally occurring elements. Protactinium was identified by Fajans and G?hring in 1913 who named the new element brevium (""brief"")."
92, U , Uranium,1789,Martin Klaproth,Klaproth recognized an unknown element in pitchblende and attempted to isolate the metal in 1789. He named the element for the planet uranus which had just been discovered. The radioactive nature of uranium was not appreciated for another 55 years when in 1896 Henri Becquerel detected its radioactivity.
93, Np , Neptunium,1940,"McMillan, Abelson","Neptunium was the first synthetic transuranium element of the actinide series. It was discovered by McMillan and Abelson in 1940 at Berkeley, California, USA, who bombarded uranium with neutrons produced from a cyclotron. It was the first synthetic transuranium (elements after uranium) element discovered."
94, Pu , Plutonium,1940,"Seaborg, McMillan, Kennedy,Wahl ","Plutonium was synthesized by Seaborg, McMillan, Kennedy and Wahl in 1940 by deuteron bombardment of uranium in a cyclotron (a device used to accelerate atomic particles) at Berkeley, USA. Plutonium was the second transuranium element of the actinide series to be discovered."
95, Am , Americium,1944,Glenn Seaborg,Americium was was identified by Seaborg and others in 1944 as the result of successive neutron capture reactions by plutonium isotopes in a nuclear reactor.
96, Cm , Curium,1944,Glenn T. Seaborg,"Curium was identified by Seaborg and others in 1944 as a result of helium ion bombardment of the plutonium isotope 239Pu. Three years later visible amounts of the hydroxide were isolated by Werner and Perlman. In 1951, the same workers prepared curium in its elemental form for the first time."
97, Bk , Berkelium,1949,Albert Ghiorso,"Berkelium was discovered in December 1949 at Berkeley, Californi, USA, by Ghiorso and others by cyclotron bombardment of milligram amounts of americium with helium ions. Perhaps the first visible amounts of a pure berkelium compound, berkelium chloride, was produced in 1962. It weighed just 3 billionth of a gram."
98, Cf , Californium,1950,Albert Ghiorso,"Californium was produced by Ghiorso and others at the University of California, Berkeley, USA in 1950 who bombarded 242Cm with helium ions."
99, Es , Einsteinium,1952,Albert Ghiorso,"Einsteinium was identified by Ghiorso and others (Berkeley, California, USA) in 1952 in radioactive debris from the first large thermonuclear bomb explosion, which took place in the Pacific in November 1952. In 1961, a sufficient amount of einsteinium was produced to permit separation of a macroscopic amount of 253Es."
100, Fm , Fermium,1952,Albert Ghiorso,"Fermium was identified by Ghiorso and coworkers (Berkeley, California, USA) in 1952 in the radioactive debris from a thermonuclear explosion in the Pacific. Somewhat remarkably, the fermium isotope discovered was made through the combination of 238U with 17 neutrons. Today, many isotopes are known spanning the mass range 243-258."
101, Md , Mendelevium,1955,Seaborg,"Mendelevium, the ninth transuranium element of the actinide series to be discovered, was first identified by Seaborg and others in 1955 as a product of the bombardment of the einsteinium isotope 253Es with helium ions. The isotope produced was 256Md, which has a half-life of about 11/4 hours."
102, No , Nobelium,1957,Nobel Institute for Physics. Sweden,A team working in Stockholm reported in 1957 an isotope whose atomic number is 102. They made this isotope by bombardment of 244Cm with 13C ions. They named the element nobelium after Alfred Nobel. 
103, Lr , Lawrencium,1961,"University of California, Berkeley","Element 103, lawrencium, was discovered in 1961 by Ghiorso and others in Berkeley, California, USA, who bombarded a californium target with boron ions. They obtained perhaps two micrograms. Several lawrencium isotopes including those with masses 253, 254, 255, 256, 257, 258, 259, and 260 are known now."
104, Rf , Rutherfordium,1969,"University of California, Berkeley",In 1969 an American group at Berkeley (California) in the USA reported isotopes of Element 104. Their experiments involved reaction high energy collisions between 249Cf and 12C. The group also indicated that they were unable to reproduce the earlier Russian synthesis from1964. The American group proposed for the new element the name Rutherfordium
105, Db , Dubnium,1967,"Joint Research Institute, Russia","In 1967, Flerov reported element 105 after experiments at the Joint Research Institute in Russia involving reactions between 243Am ions with 22Ne ions. In 1970, Ghiorso and others announced their synthesis of dubnium at Berkeley (California) in the USA. This method involved the collsion of 249Cf ions with 15N ions."
106, Sg , Seaborgium,1974,Lawrence Berkeley Laboratory,"Transuranium elements such as seaborgium can be created artificially in particle accelerators. Isotopes of seaborgium have short half-lives of less than a second. The first report of element 106 came in 1974 from the Soviet Joint Institute for Nuclear Research and these were followed later by others from Berkeley in California, USA."
107, Bh , Bohrium,1976,Gesellschaft für Schwerionenforschung,Scientists from the USSR reported their production of an isotope of bohrium in 1976 and this work was substantiated by German workers later.
108, Hs , Hassium,1984,Gesellschaft für Schwerionenforschung,"Hassium was discovered by Peter Armbruster, Gottfried Münzenber and their co-workers. at 1984 in Gesellschaft für Schwerionenforschung (GSI) in Darmstadt, Germany.The origin of the name is the Latin word ""Hassias"" meaning ""Hess"", the German state."
109, Mt , Meitnerium,1982,Gesellschaft für Schwerionenforschung,"In August 1982 the first atom of the element meitnerium with atomic number 109 was detected at the Gesellschaft für Schwerionenforschung (GSI) in Darmstadt, Germany. The isotope of element 109 which was discovered has an atomic mass number of 266 (that is, 266 times heavier than hydrogen)"
110, Ds , Darmstadtium,1994,Gesellschaft für Schwerionenforschung,"In 1994 the first atom of element 110, darmstadtium, was detected at the Gesellschaft für Schwerionenforschung (GSI) in Darmstadt, Germany. The isotope discovered has an atomic number of 269 (that is, 269 times heavier than hydrogen)."
111, Rg , Roentgenium,1994,Gesellschaft für Schwerionenforschung,"Element 111, roentgenium, was discovered towards the end of 1994 at the GSI in Darmstadt, Germany. Three atoms of an isotope 272Uuu were produced in reactions between 209Bi targets and 64Ni projectiles. To achieve this, the nickel atoms were accelerated to high energies by the heavy ion accelerator UNILAC at GSI and directed onto a lead target."
112, Cn , Copernicium,1996,Gesellschaft für Schwerionenforschung,"Element 112 (provisionally named copernicium, Cn) was discovered on 9th February 1996 at 22:37 at the GSI in Darmstadt, Germany. The identified isotope currently is the heaviest atom ever produced by man and has an atomic mass of 277, that is, 277 times heavier than hydrogen."
113, Uut , Ununtrium,2003,"Joint Research Institute, Russia","In experiments conducted at the JINR U400 cyclotron with the Dubna gas-filled separator between July 14 and Aug. 10, 2003, atomic decay patterns were observed said to confirm the existence of element 115 and element 113. In these decay chains, element 113 is produced via the ?-decay of element 115"
114, Uuq , Ununquadium,1998,"Joint Research Institute, Russia","Only one atom of element 114 (289114Uuq)has ever been made (through a nuclear reaction involving fusing a calcium atom with a plutonium atom) isolation of an observable quantity has never been achieved, and may well never be"
115, Uup , Ununpentium,2003,"Joint Research Institute, Russia","In experiments conducted at the JINR U400 cyclotron with the Dubna gas-filled separator between July 14 and Aug. 10, 2003, atomic decay patterns were observed said to confirm the existence of element 115 and element 113. In these decay chains, element 113 is produced via the ?-decay of element 115"
116, Uuh , Ununhexium,2000,Russia - USA Collaboration,"Results published on the 6th December 2000 concerning recent experiments at Dubna in Russia  describe the decay of the isotope 292Uuh (produced in the reaction of 248Cm with 48Ca) to 292Uuq. This decayed 47 milliseconds later as follows to a previously identified isotope of elements 114, Uuq"
117, Uus , Ununseptium,2010,Russia - USA Collaboration,"Claims for the formation of element 117 (ununseptium, Uus) were first publsihed in April 2010."
118, Uuo , Ununoctium ,2002,Russia - USA Collaboration,"Experiments conducted at Dubna in Russia at the Flerov Laboratory of Nuclear Reactions (by workers from the Joint Institute for Nuclear Research in Russia and the Lawrence Livermore National Laboratory in the USA) indicate that element 118 (ununoctium, Uuo) was produced. Not too much though, one atom in the spring of 2002 and two more in 2005."